<?xml version="1.0" encoding="utf-8" ?>
<screendef xmlns:xsi="http://www.w3.org/2001/XMLSchema-instance" xsi:noNamespaceSchemaLocation="..\Xsd\Grid.xsd">
  <mode>0</mode>

  <DefaultOrderBy>MAIL_DATE DESC</DefaultOrderBy>
  <DefaultFileOrderBy></DefaultFileOrderBy>
  <KeepSearchScreenVisible>false</KeepSearchScreenVisible>
  <FolderText>false</FolderText>
  <FiltersFile></FiltersFile>
  <GroupingFile>MailfollowupGrouping.xml</GroupingFile>
  <ToolbarFile>mailfollowuptoolbar.xml</ToolbarFile>

  <columns>
    <column name="multiselect"></column>
    <column name="status" />
    <column name="mailsubject" chars="100" extra="NOWRAP" labelE="Subject" labelN="Onderwerp" labelF="Sujet" ></column>
    <column name="mailto" labelE="To" labelN="Aan" labelF="Vers"></column>
    <column name="maildate" labelE="Date" labelN="Datum" labelF="Date"></column>
    <column name="mailreaddate" labelE="Read" labelN="Gelezen" labelF="Lu"></column>
    <column name="mailreplieddate" labelE="Replied" labelN="Geantwoord" labelF="Répondu"></column>
    <column name="mailcloseddate" labelE="Closed" labelN="Afgesloten" labelF="Terminé"></column>
  </columns>
  <rows>


  </rows>
</screendef>