<?xml version="1.0" encoding="utf-8" ?>
<screendef xmlns:xsi="http://www.w3.org/2001/XMLSchema-instance" xsi:noNamespaceSchemaLocation="..\Xsd\Grid.xsd">
  <mode>0</mode>
  <ImageListColumnCount>3</ImageListColumnCount>
  <ImageListOrientation>0</ImageListOrientation>
  <DefaultOrderBy>MAIL_DATE DESC</DefaultOrderBy>
  <DefaultFileOrderBy></DefaultFileOrderBy>
  <KeepSearchScreenVisible>false</KeepSearchScreenVisible>
  <FolderText>false</FolderText>
  <GroupingFile>MailGrouping.xml</GroupingFile>
  <ToolbarFile>mymailtoolbar.xml</ToolbarFile>

  <columns>
    <column name="expand"></column>
    <column name="status"></column>
    <column name="multiselect"></column>
    <column name="version"></column>
    <column name="mailsubject" chars="100" extra="NOWRAP" ></column>
    <column name="maildate"></column>
    <column name="mailfrom"></column>
    <column name="mailto"></column>
  </columns>
</screendef>



