<?xml version="1.0" encoding="utf-8" ?>
<screendef xmlns:xsi="http://www.w3.org/2001/XMLSchema-instance" xsi:noNamespaceSchemaLocation="..\Xsd\Grid.xsd">
  <ToolbarFile>DefaultPackageGridToolbar.xml</ToolbarFile>
  <columns>
    <column name="status" ></column>
    <column name="version"></column>
    <column name="title" chars="100" extra="NOWRAP" labelE="Title" labelN="Titel" labelF="Titre"></column>
    <column name="category" size="100" hidefilter="n"></column>
    <column name="creationdate"></column>
    <column name="documentlinks" size="80"></column>
  </columns>
</screendef>
