<?xml version="1.0" encoding="utf-8" ?>
<screendef xmlns:xsi="http://www.w3.org/2001/XMLSchema-instance" xsi:noNamespaceSchemaLocation="..\Xsd\Grid.xsd">
  <mode>0</mode>

  <DefaultOrderBy>MAIL_DATE DESC</DefaultOrderBy>
  <DefaultFileOrderBy></DefaultFileOrderBy>
  <KeepSearchScreenVisible>false</KeepSearchScreenVisible>
  <FolderText>false</FolderText>
  <FiltersFile></FiltersFile>
  <GroupingFile>NoGrouping.xml</GroupingFile>
  <ToolbarFile>LinkedMailsToolbar.xml</ToolbarFile>
  <ItemContextMenus>false</ItemContextMenus>
  <columns>
    <column- name="multiselect"></column->   
    <column name="mailsubject" chars="100" extra="NOWRAP" labelE="Subject" labelN="Onderwerp" labelF="Sujet" ></column>
    <column name="mailfrom" labelE="From" labelN="Van" labelF="De"></column>
    <column name="mailto" labelE="To" labelN="Aan" labelF="Vers"></column>
    <column name="maildate" labelE="Date" labelN="Datum" labelF="Date"></column>    
  </columns>
  <rows>


  </rows>
</screendef>
